{
  "title": "hello",
  "page_id": 12345,
  "rev": 7654321,
  "tid": "1c2d3e4f-aaaa-bbbb-cccc-ddddeeeeffff",
  "namespace": 0,
  "user_id": 1,
  "user_text": "ExampleEditor",
  "timestamp": "2025-03-15T14:30:00Z",
  "comment": "typo fix",
  "tags": [],
  "restrictions": [],
  "page_language": "en"
}